"Name","Team","Bye Week","Rank","$","Points","Risk","Tier","Outlook","Dynasty","Markers"
"Christian McCaffrey","CAR","13","1","$62","315.5","6.8","1","The pain and drama that fantasy managers have felt over the last two years is nothing short of Oscar-worthy. When he's on the field, he's the elite of the elite finishing as a top-6 RB in seven of his ten starts the last two years. But the headline is the fact he's played in just 31 percent of his games the last two years. If you can't move past the emotional baggage, we get it. But facing a healthy CMC is like facing two players at the same time. We still view him as a difference-maker in an elite RB1 tier with only Jonathan Taylor in 2022.","Unlock with the 2022 UDK+. Get the UDK+.","Mark Drafted                      Mark Keeper"
"Jonathan Taylor","IND","14","2","$72","313.8","1.3","1","JTT! Yes, he was a 90’s heartthrob turned NFL RB and he certainly turned up the heat in 2021. How dominant was JTT? From Weeks 4-15, he had 11 RB1 performances in a row! To compare, Todd Gurley‘s great 2018 (10 straight) and Christian McCaffrey‘s 2019 (9 straight) fell short. He’s one of five RBs in NFL history to go for 1,800 & 18 TDs. To keep this historical train rolling, he had 89(!) red-zone rushing attempts, most of all time. The next closest in 2021: Austin Ekeler at 49! The even crazier thing is he could’ve had even more TDs… 18 different drives where he was tackled on a rushing play inside the five-yard line and didn’t end up scoring on that drive. If you want to lock in 10+ rushing TDs at the 1.01, he makes sense there for 2022.","Unlock with the 2022 UDK+. Get the UDK+.","Mark Drafted                      Mark Keeper"
"Austin Ekeler","LAC","8","3","$53","276.7","4.0","2","There were some concerns heading into the season about Ekeler not being a big TD guy and whether he could handle a big workload. After coming on the podcast in the summer, there was some doubt although Ekeler was almost one of Jason’s “My Guys”. After 300 opportunities, it’s clear he was a league winner as one of seven RBs in league history with 20 TDs & 70 receptions in the same season. He had arguably one of the best red-zone seasons of all-time scoring all 20 of his TDs there. He averaged 10 fantasy points per game inside the 20. That’s the 2nd most over the last decade with Todd Gurley (2018) averaging 11.3 in his monster season. There is some debate if fantasy managers will be able to appreciate Ekeler enough to make him a top-3 pick as part of an exciting Chargers offense. He’s deserving of it, especially in PPR leagues.","Unlock with the 2022 UDK+. Get the UDK+.","Mark Drafted                      Mark Keeper"
"Derrick Henry","TEN","6","4","$50","267.8","5.7","2","If you jumped on Henry's back over the first half of the season, the ride was a true delight. He had six RB1 performances in a row including three No. 1 overall finishes. He was on a ridiculous 464 carry pace through Week 7 before suffering a Jones fracture. Somehow Henry still finished the year 3rd in evaded tackles despite playing only eight games. He is not from this planet. He returned in the Titans' playoff loss seeing 20 carries and after an off-season of resting his foot, he should be good to go for 2022. Henry is the centerpiece, the fuel, and heart of the Titans offense and still worth a top-5 pick in redraft.","Unlock with the 2022 UDK+. Get the UDK+.","Mark Drafted                      Mark Keeper"
"Joe Mixon","CIN","10","5","$47","253.9","3.3","2","Mixon had a similar season on a per-game basis as his sophomore year (2018- RB9) but ended up playing a full season this time. He totaled the 3rd most carries, 5th most red-zone touches, and the 4th most TDs among all RBs. But he became a stalwart in the middle of the season. From Weeks 6-12, he had 23+ fantasy points in 5-of-6 weeks! With the Bengals' offense ready to roll with its young nucleus, it’s clear Mixon is an easy 1st round pick in 2022.","Unlock with the 2022 UDK+. Get the UDK+.","Mark Drafted                      Mark Keeper"
"Dalvin Cook","MIN","7","6","$47","251.9","3.0","2","Dalvin is as advertised: a top-notch fantasy RB when he's on the field but he's also never played a full season in his career. The usage is incredible as he saw the 5th most carries and finished with the 2nd most 15+ yard runs in the NFL. However, the big stain on his 2021 campaign was averaging a rushing TD once every 41.5 carries, a massive dip from the 19.4 he averaged over the previous two seasons. He should bounce back to double-digits in 2022 and the Vikings offense is one we are bullish on overall. Cook comes at a relative discount from his previous years but we still view him as an RB1 in the first round of your draft.","Unlock with the 2022 UDK+. Get the UDK+.","Mark Drafted                      Mark Keeper"
"Alvin Kamara","NO","14","7","$46","251.1","3.5","2","We didn’t quite get the Super Kamario of old in 2022. Apart from missing Weeks 10-13, he dealt with having three different QBs (four if you count that one Ian Book game) and an offensive line that faced a ton of injuries. New Orleans started 13(!) different offensive linemen on the year. Kamara still averaged 22 touches per game, led all RBs in target share (20%), and saw the 5th most red-zone touches. However, he totaled only four rushing TDs, very “unKamarian” to say the least. Since 2010, Kamara tied for 2nd fewest rushing TDs (4) among RBs with 240+ carries in a season. In that sample size of 125 RBs… TD expectation for 240+ carries was 8.8 rush TDs. With his legal situation up in the air, Kamara could face up to a six-game suspension. Until details clear up further, he's a major risk/reward pick in the 2nd round.","Unlock with the 2022 UDK+. Get the UDK+.","Mark Drafted                      Mark Keeper"
"Najee Harris","PIT","9","8","$42","239.2","3.7","3","Harris’ greatness might’ve flown under the radar. He’s one of 11 RBs in NFL history with 300+ carries & 90+ targets in a season. He led the league in touches as a rookie which only four RBs (Eric Dickerson, Edgerrin James, LaDainian Tomlinson & Najee) have done in league history. Some of the inefficiency might come to the surface in complaints but an offense led by Big Ben and the Steelers' offensive line wasn’t helpful. Harris had the 2nd lowest yards per carry (3.91) ever among rookie RBs with 1,200+ rushing yards. The lowest? The aforementioned LaDainian Tomlinson at 3.65. He was fine and Najee will be too moving forward. The opportunity was glorious but there are a few red flags heading into 2022. The team talked about easing his workload to ensure health and production. A new QB also brings an added variable as we have no idea how Mitchell Trubisky or Kenny Pickett will handle this offense. He's still an RB1 in our book but more of a mid-second-round player given the risks. We can't simply copy and paste last year's number for Harris.","Unlock with the 2022 UDK+. Get the UDK+.","Mark Drafted                      Mark Keeper"
"Leonard Fournette","TB","11","9","$41","236.4","3.3","3","Fournette was a fantasy savior for many who needed to plug their RB spot in the middle of the year. From Weeks 4-15, he was the RB3. His pace during that span was 349 opportunities (including 88 receptions). The passing work is what helped boost him averaging five receptions per game on the season. He’s still only 27 years old so Fournette proved he still has some good football left. He's a low-end RB1 but you likely won't have to pay that type of premium price in your draft.","Unlock with the 2022 UDK+. Get the UDK+.","Mark Drafted                      Mark Keeper"
"Ezekiel Elliott","DAL","9","10","$40","235.7","4.3","3","Towards the end of the year, the prevailing narrative surrounding Zeke was that he was old and busted. While the Dallas offensive line was still elite, Elliott struggled to hit the century mark rushing the ball. It wasn’t for a lack of playing time as he ran the 2nd most routes of all RBs. He still was solid and in a season with lots of injuries at the RB position, he felt more like a low-end RB1 than someone who finished at RB6. His contract is an albatross so he’ll be right back to being the dude in Dallas in 2022. The old Zeke is gone but he could end up being a value as an RB2 slipping past the third round in drafts.","Unlock with the 2022 UDK+. Get the UDK+.","Mark Drafted                      Mark Keeper"
"D'Andre Swift","DET","6","11","$40","235.4","4.3","3","Swift might be top-5 in the NFL in terms of pure RB talent. In 2021, he had the most yards created per touch among RBs and started the year as a fantasy difference-maker as the RB7 through Week 11. But he's had the injury bug bite him each of his first two seasons and Jamaal Williams is annoyingly still around. Swift's calling card is being one of the best pass-catchers at the position. He's one of seven RBs over the last decade with 100+ receptions and 15 TDs in their first two years. The talent and opportunity are there for him to put it fully together as an elite RB1 this year. He's a 2nd round redraft pick with the biggest risk being taking a Lions RB this early and living to tell the tale.","Unlock with the 2022 UDK+. Get the UDK+.","Mark Drafted                      Mark Keeper"
"James Conner","ARI","13","12","$39","234.7","6.3","3","The headline for Conner’s 2021 season was 18 TDs! Not bad for a player you drafted in the 8th round. With the 2nd most goal-line carries and the most expected points added per rush attempt among RBs, he was a machine despite only 752 rushing yards.  Apart from TDs, he had several other solid overall metrics including his most forced missed tackles (40) of his career. Conner is only 26 years old and should see an every-down role in 2022. He is a borderline 1st/2nd round pick with the type of usage he saw.","Unlock with the 2022 UDK+. Get the UDK+.","Mark Drafted                      Mark Keeper"
"Aaron Jones","GB","14","13","$42","234.4","2.7","3","Jones finished barely inside the top-12 on the back of the 6th most RB receptions and the 9th most red-zone touches. While he finished out the fantasy season on a high note, he busted more than you would want (27% of the time) for an RB1. A.J. Dillon clearly has emerged as a valuable part of this offense but there is a world where both can coexist for fantasy. The Packers have the 5th most vacated targets in the NFL and our research shows often the RB position is the one that benefits the most when there is turnover. He's a relative value at the beginning of the 3rd round in drafts and someone we are high on while fantasy managers might be souring.","Unlock with the 2022 UDK+. Get the UDK+.","Mark Drafted                      Mark Keeper"
"Nick Chubb","CLE","9","14","$37","222.1","3.3","3","At this point in his career, we know what Chubb brings to the table: monster rushing totals and one of the best tackle breakers in the NFL. He's the diet cola version of Derrick Henry, which is a massive compliment. Since coming into the league in 2018, Chubb trails only Henry in total rushing yards and finished as an RB1 each of the last three years. However, you know you're not getting much in the passing game averaging just 24 receptions per year. The Cleveland offense could be exciting with Deshaun Watson under center but his looming suspension brings an added risk to start the season. Chubb is a fringe RB1 with more boom/bust weeks than you might like.","Unlock with the 2022 UDK+. Get the UDK+.","Mark Drafted                      Mark Keeper"
"Javonte Williams","DEN","9","15","$36","219.5","3.3","4","The tickets for the Javonte hype train were mailed and people were waiting at the train station ready to hop aboard before the Broncos re-signed Melvin Gordon late in the free-agency period. We were ready to crown Williams a top-10 back with upside to finish inside the top-3 at the position. Regardless, his rookie year was super encouraging with over 1,200+ yards from scrimmage and more than 50 targets. He was a force with the ball in his hands with the 6th most forced missed tackles among RBs. The Denver offense should be one to buy into across the board with Russell Wilson behind center. He's now more of a solid RB2 with Gordon around but everything in his profile says a breakout is coming.","Unlock with the 2022 UDK+. Get the UDK+.","Mark Drafted                      Mark Keeper"
"Saquon Barkley","NYG","9","16","$35","219.3","5.0","4","It's Saquon's 5th year in the league but it feels like it's been eons since we've last seen this superhuman fully on the field. The Giants' offense was a laughingstock by the end of the year as the team hit their Vegas team implied total only five times all year. After returning from his injury and the Week 10 bye, Barkley averaged 3.7 yards per carry, scored one TD, and finished inside the top-20 among RBs just once. It was painful to watch if you had high hopes at the beginning of the season. He's now sunk so far down in the minds of fantasy managers that he becomes a potential value in 2022. You could do a lot worse than finding an RB2 in the third round.","Unlock with the 2022 UDK+. Get the UDK+.","Mark Drafted                      Mark Keeper"
"David Montgomery","CHI","14","17","$31","203.2","3.7","4","Montgomery once again was a league-winner in fantasy as the RB2 from Week 13 through the fantasy playoffs. It's now back-to-back years that he's come on in the second half. The Bears seem willing to make him the only show in town at RB. His usage was elite seeing 86 percent of the RB rush attempts and 74 percent of the RB targets from Week 9 on. While the offense in Chicago projects as one of the least efficient in the league, his pace when he returned from injury last year was 374 opportunities. You can't find that type of workload too often this late in your draft. He's a perfect RB2 for your roster.","Unlock with the 2022 UDK+. Get the UDK+.","Mark Drafted                      Mark Keeper"
"Josh Jacobs","LV","6","18","$30","202.4","4.3","5","Jacobs gave fantasy managers about as solid an RB2 season as you could ask for. He saw the 5th most RB receptions after the Raiders finally came to their senses and nine rushing TDs on the ground. RB15 is nothing to shy away from but realize Kenyan Drake also missed half the season with an ankle injury. After the new coaching regime and management did not exercise his 5th-year option, Jacobs could be in his last year in the silver and black. Over the last three years, only Dalvin Cook has more red-zone rushing attempts than Jacobs so you're banking on 8+ rushing TDs on the ground. Consider him in the RB15-20 range which is a valuable asset in fantasy but the ceiling likely isn't much higher.","Unlock with the 2022 UDK+. Get the UDK+.","Mark Drafted                      Mark Keeper"
"Breece Hall","NYJ","10","19","$28","196.0","4.7","5","The Jets traded up to get Hall in the 2nd round and the only competition in front of him is 5'8"" Michael Carter. Hall likely won't dominate all three downs but he has everything you want in his production profile. Overtaking the diminutive Carter on 3rd down is only a matter of time. We've seen at least two rookie RBs finish inside the top-24 each of the last seven years and Hall has the best shot to be part of that group in 2022. Consider him an RB2 with upside although the Jets offense will need to prove itself more competent than 28th in points per game for him to hit a ceiling outcome.","Unlock with the 2022 UDK+. Get the UDK+.","Mark Drafted                      Mark Keeper"
"Cordarrelle Patterson","ATL","14","20","$27","191.4","3.7","5","If you saw Patterson's 2021 season coming, take a bow. He came out of nowhere as the lone Atlanta Falcons player with weekly upside for fantasy, From Weeks 2-14, he was the RB7 in total points and RB9 in fantasy points per game. However, he ran out of gas in the final month (RB56, 31, 37, 70) which raises some questions heading into 2022. He scored more points as a receiver than as a rusher making him an odd RB to project moving forward. The only competition in the backfield is journeyman Damien Williams and 5th-round rookie Tyler Allgeier. Approach with caution knowing you could have your draft pick evaporate into thin air.","Unlock with the 2022 UDK+. Get the UDK+.","Mark Drafted                      Mark Keeper"
"Antonio Gibson","WAS","14","21","$27","190.9","5.0","5","From Weeks 1-8, he was the RB19 in total points and the RB29 averaging only 10.9 fantasy points per game. However, the second half was a different story. From Week 10 on, he was the RB4. Some of this success was due to the absence of J.D. McKissic, who was concussed in Week 12 and did not return for the rest of the season. From that point on, Gibson saw five targets per game. Overall, he still tied with Joe Mixon for 2nd most 1st downs among all RBs. But the TDs were the major story. In 2020, he had a TD every 15 carries; in 2021, that regressed to every 37 carries. His floor seems high but the dreams of him being a top-5 guy are likely over. He's more of an RB2 moving forward when you also add in the wildcard that is Carson Wentz.","Unlock with the 2022 UDK+. Get the UDK+.","Mark Drafted                      Mark Keeper"
"Travis Etienne Jr.","JAX","11","22","$25","187.4","6.0","5","Etienne's Lisfranc injury was just the beginning of a forgettable season in Jacksonville. But now the slate can be wiped clean and all Urban Meyer-related thoughts can be cast aside. Remember this team spent 1st round draft capital on him and everything in his production and athletic profile states he could see 60+ receptions right away. He's settling in nicely as a 5th-round RB with upside to finish inside the top-15 if things break right.","Unlock with the 2022 UDK+. Get the UDK+.","Mark Drafted                      Mark Keeper"
"Cam Akers","LAR","7","23","$24","183.6","6.7","5","Akers' Achilles injury and his recovery were one of the major fantasy storylines of 2022 especially after returning in the NFL playoffs. While the Rams win the Super Bowl, Akers was thrust into the lead role with mixed reviews. He averaged a porous 3.3 yards per touch and some of the burst we saw in his rookie year looked lost. With more than a year removed from the injury, Akers is getting hyped as a potential RB1 in fantasy this year. We aren't as bullish on his prospects tempering our expectations more in the low-end RB2 range. While 15+ touches a game seems fair to project, the efficiency might leave much to be desired.","Unlock with the 2022 UDK+. Get the UDK+.","Mark Drafted                      Mark Keeper"
"Chase Edmonds","MIA","11","24","$24","181.0","5.0","5","As the Cardinals season went, so went Edmonds. Through Week 8, the Cardinals were 7-1 as Edmonds was the RB20 averaging 14 opportunities per game including a healthy 4.6 targets. However, he was injured the next week and didn't return until Week 15. Now in Miami after signing one of the first free-agent deals of the off-season, he'll be in the mix with Raheem Mostert, Sony Michel, and Myles Gaskin. Edmonds profiles as the best fantasy option of the bunch given his receiving abilities but it's hard to envision more than FLEX territory for him.","Unlock with the 2022 UDK+. Get the UDK+.","Mark Drafted                      Mark Keeper"
"AJ Dillon","GB","14","25","$24","180.1","3.3","5","Dillon started slowly behind Aaron Jones before becoming a viable RB2 the rest of the season. In Week 10, he was the RB1 on the week against Seattle showcasing what kind of potential he has in fantasy. He saw the same number of goal-line carries as Jones and worked in the passing game way more than you might have realized with 34 receptions, the same amount as Dalvin Cook. Dillon's weekly floor might be scary but the Packers might have to send both RBs out on the field together more often with a lack of dependable options in the passing game. Consider him an RB2 with massive upside with the added intimidation he brings to your squad with the best quads in the league.","Unlock with the 2022 UDK+. Get the UDK+.","Mark Drafted                      Mark Keeper"
"Clyde Edwards-Helaire","KC","8","26","$23","179.1","5.0","5","We've come a long way since CEH was a top-5 redraft pick his rookie year. But it felt like it was the same refrain last year with some early excitement after two 100+ rushing yard games before suffering a knee injury and going on injured reserve. While he returned in Week 11, it always felt like Darrel Williams and Jerick McKinnon were the more trusted backs. Kansas City has the 2nd most vacated targets in the NFL where CEH could certainly benefit to see an uptick in passing work. He's a value but expecting anything more than low-end RB2 production might be wishful thinking.","Unlock with the 2022 UDK+. Get the UDK+.","Mark Drafted                      Mark Keeper"
"Rashaad Penny","SEA","11","27","$23","178.7","6.3","5","For the first 12 weeks of the season, you probably forgot Penny was even in the league with 43 total rush yards as the (checks notes... scrolls... hold on... wait for it...) RB119. Heck, his brother Elijhaa Penny had more fantasy points as a full-back. But boy did things change... He ended up leading the league in yards per carry (6.3) and running for 700+ in his final six games. It was the stuff of fantasy legends and the Seahawks decided to bring him back on a one-year deal. He's a bruiser so his running style might not hold up over the course of a season. With Kenneth Walker III selected in the 2nd round, you're not expecting the same magic from Penny for long. But maybe he's the type of first-half RB2 your team needs at an affordable draft price.","Unlock with the 2022 UDK+. Get the UDK+.","Mark Drafted                      Mark Keeper"
"Elijah Mitchell","SF","9","28","$22","174.0","4.7","5","Mitchell was one of our favorite dynasty sleepers last off-season but there was no way we'd imagine he would tie for the 2nd most 100-yard rushing games behind Jonathan Taylor. The Missle supplanted fellow rookie Trey Sermon very quickly seeing the most elite usage of any RB we've seen in the Kyle Shanahan system in San Francisco. From Week 10 through the NFL playoffs, he averaged 26 opportunities per game. However, there are some red flags as he missed three separate stints of the season due to injury woes. The 49ers also surprisingly selected RB Tyrion Davis-Price in the 3rd round to add to any already nauseous backfield rotation. He comes with a lot of risk but the lead dog in the 49ers backfield can be a valuable commodity. He's more of a low-end RB2 knowing Trey Lance brings the entire offense into question.","Unlock with the 2022 UDK+. Get the UDK+.","Mark Drafted                      Mark Keeper"
"Kareem Hunt","CLE","9","29","$22","173.6","4.3","5","You might've forgotten but Hunt started out the year on fire scoring five TDs in his first five games. Before going down with an injury in Week 6, he averaged 87 total yards per game as the RB8 in fantasy. He tried to return from his ankle injury but it was a lost season for Hunt and the rest of the Browns. A lot has changed since with Deshaun Watson in town and now Hunt enters the final year of his contract. He'll always play second-fiddle to Nick Chubb in terms of usage. If there is another area of concern, it's the fact that during his last three full years as the Texans' starting QB, Watson targeted the RB position 14.7 percent of the time, dead last in the NFL. He'll need to overcome Chubb and Watson to truly be a fantasy force once again. He's a risk/reward RB in the 7th round.","Unlock with the 2022 UDK+. Get the UDK+.","Mark Drafted                      Mark Keeper"
"Miles Sanders","PHI","7","30","$20","169.6","4.8","6","Sanders somehow failed to score one of the Eagles' league-leading 25 rushing TDs despite leading the team with 137 carries. For context, he's one of five different RBs with zero rushing TDs on that many attempts since 2010, the most recent Frank Gore. Not exactly great company. But we love this as a bounce-back spot on an offense that seems to be trending upwards. He ran for 5.5 yards per carry last season including two monster games (Week 13 & 15) where he simply didn't get in the end-zone. Fellow RB Boston Scott sees more goal-line work than you want and Kenneth Gainwell will mix in too. Still, Sanders can return RB2 value even with a league average TD amount (6+) based on his usage.","Unlock with the 2022 UDK+. Get the UDK+.","Mark Drafted                      Mark Keeper"
"J.K. Dobbins","BAL","10","31","$18","165.4","7.2","6","Dobbins will be a full year removed from his ACL tear once the season starts. As a rookie, nine percent of Dobbins’ rush attempts were 15+ Yards, the highest in the NFL. His insane TD rate might come down but the explosive runs were always part of his profile coming into the league. This offense should revert to being top-5 in rush rate in 2022 making Dobbins's current 4th round ADP a relative steal. He can add 25-30 receptions giving him a higher floor than most other backs in that range. It shouldn't shock you if he ends up as an RB1 this year.","Unlock with the 2022 UDK+. Get the UDK+.","Mark Drafted                      Mark Keeper"
"Damien Harris","NE","10","32","$19","164.3","5.3","6","Harris broke out in 2021 with 15 rushing TDs as one of the better fantasy steals finishing at RB13. That end-of-season finish might be a bit inflated knowing there were so many injuries to other high-end RBs. Nevertheless, he feasted against AFC East opponents averaging 87 rushing yards and scoring eight times on the ground. Expect the elite TD total to come down with Rhamondre Stevenson taking over more of the workload and James White back in the mix. He's a gamble this year as an RB2 and one we'd rather not take.","Unlock with the 2022 UDK+. Get the UDK+.","Mark Drafted                      Mark Keeper"
